{
    "$schema": "http://json-schema.org/draft-07/schema#",
    "$id": "https://ofn.gov.cz/akce/draft/schémata/akce.json",
    "type": "array",
    "title": "Akce",
    "items": {
        "$id": "#/items",
        "type": "object",
        "title": "Akce",
        "properties": {
            "iri": {
                "$id": "#/items/properties/id",
                "type": "string",
                "format": "iri",
                "title": "Identifikátor",
                "description": "",
                "examples": [
                    "https://brno.cz/zdroj/akce/abcd"
                ]
            },
            "název": {
                "$ref": "https://ofn.gov.cz/základní-datové-typy/draft/schémata/text.json"
            },
            "popis": {
                "$ref": "https://ofn.gov.cz/základní-datové-typy/draft/schémata/text.json"
            },
            "obrázek": {
                "$ref": "https://ofn.gov.cz/základní-datové-typy/draft/schémata/url.json"
            },
            "pořadatel": {
                "type": "array",
                "items": {
                    "$ref": "https://ofn.gov.cz/lidé-a-osoby/draft/schémata/člověk-či-osoba.json"
                }
            },
            "hlavní_sponzor": {
                "type": "array",
                "items": {
                    "$ref": "https://ofn.gov.cz/lidé-a-osoby/draft/schémata/člověk-či-osoba.json"
                }
            },
            "sponzor": {
                "type": "array",
                "items": {
                    "$ref": "https://ofn.gov.cz/lidé-a-osoby/draft/schémata/člověk-či-osoba.json"
                }
            },
            "mediální_partner": {
                "type": "array",
                "items": {
                    "$ref": "https://ofn.gov.cz/lidé-a-osoby/draft/schémata/člověk-či-osoba.json"
                }
            },
            "umístění": {
                "type": "array",
                "items": {
                    "$ref": "https://ofn.gov.cz/umístění/draft/schémata/umístění.json"
                }
            },
            "trvání": {
                "type": "array",
                "items": {
                    "$ref": "https://ofn.gov.cz/základní-datové-typy/draft/schémata/časový-interval.json"
                }
            },
            "kontakt": {
                "type": "array",
                "items": {
                    "$ref": "https://ofn.gov.cz/kontakty/draft/schémata/kontakt.json"
                }
            },
            "vstupné": {
                "type": "array",
                "items": {
                    "$ref": "https://ofn.gov.cz/vstupné/draft/schémata/vstupné.json"
                }
            }
        }
    }
}