[{
    "iri": "https://brno.cz/vinobraní/2019",
    "název": {
        "cs": "Brněnské vinobraní"
    },
    "popis": {
        "cs": "Město Brno Vás zve na již 21. vinobraní."
    },
    "obrázek": "https://brno.cz/vinobrani.jpg",
    "pořadatel": [{
        "osoba": {
            "ičo": "44992785",
            "název": "Statutární město Brno"
        }
    }],
    "hlavní_sponzor": [{
        "osoba": {
            "ičo": "44992785",
            "název": "Vinařství Vinam"
        }
    }],
    "sponzor": [{
        "osoba": {
            "ičo": "35922742",
            "název": "Vinařství Znovín"
        },
        "osoba": {
            "ičo": "65885514",
            "název": "Vinařství Valtice"
        }
    }],
    "mediální_partner": [{
        "osoba": {
            "ičo": "56485227",
            "název": "Brněnský denník"
        }
    }],
    "umístění": [{
        "geometrie": {
            "type": "Point",
            "coordinates": [15.9915114, 48.8566829]
        },
        "adresa": {
            "iri_adresního_místa": "https://linked.cuzk.cz/resource/ruian/adresni-misto/16135661"
        }
    }],
    "trvání": [{
        "začátek": {
            "datum_a_čas": "2019-01-01T09:30:00+02:00"
        },
        "konec": {
            "datum_a_čas": "2019-01-07T18:00:00+02:00"
        }
    }, {
        "začátek": {
            "datum_a_čas": "2019-01-14T09:30:00+02:00"
        },
        "konec": {
            "datum_a_čas": "2019-01-20T18:00:00+02:00"
        }
    }],
    "kontakt": [{
        "email": "akce@brno.cz",
        "mobil": "+420123456789",
        "facebook": "ChytreBrno",
        "instagram": "chytrebrno",
        "twitter": "chytrebrno",
        "url": "https://data.brno.cz"
    }],
    "vstupné": [{
        "název": {
            "cs": "Pro dospělé ve vybrané dny a časy"
        },
        "podmínka": {
            "cs": "Občané starší 18 let, kteří nevyuživají slevy(ZTP, studenti)."
        },
        "časová_platnost": [{
            "začátek": {
                "datum_a_čas": "2019-01-01T09:30:00+02:00"
        },
            "konec": {
                "datum_a_čas": "2019-01-05T18:00:00+02:00"
        }
    }, {
            "začátek": {
                "datum_a_čas": "2019-01-14T09:30:00+02:00"
        },
            "konec": {
                "datum_a_čas": "2019-01-19T18:00:00+02:00"
        }
    }],
        "částka": {
            "výše": 219.90,
            "měna": "CZK"
        }
    }, {
        "název": {
            "cs": "Pro děti"
        },
        "podmínka": {
            "cs": "Občané mladší 18 let"
        },
        "částka": {
            "výše": 180.90,
            "měna": "CZK"
        }
    }]
}]